id	Definition
PWN:investment.n.02	λεφτά που επενδύονται σε κάποιο χώρο με την προσδοκία ότι θα αποφέρουν κέρδος
PWN:invitation.n.01	το κάλεσμα (κάποιου) να παραστεί ή να συμμετάσχει (κάπου)
PWN:invite.v.01	καλώ (σε αναμέτρηση κλπ)
PWN:invite.v.02	απευθύνω πρόσκληση σε κάποιον, του ζητώ να έρθει σε οικείο ή δικό μου χώρο,σε εκδήλωση που διοργανώνω ή στην οποία μετέχω
PWN:invite.v.04	ζητώ με φιλικό τρόπο από κάποιον να κάνει κάτι
PWN:invite.v.05	ζητώ από κάποιον να έρθει, να παρευρεθεί, να συμμετάσχει σε μια κοινωνική εκδήλωση ιδιωτικού ή δημόσιου χαρακτήρα
PWN:invite.v.06	καλώ κπ να έρθει σε μένα ή να μεταβεί κάπου
PWN:invite.v.07	ζητώ την παρουσία ή την συμμετοχή κάποιου
PWN:involve.v.02	βάζω κάποιον να συμμετέχει σε κάτι, συμπεριλαμβάνω, εντάσσω
PWN:iris.n.02	το μπροστινό τμήμα του αγγειακού χιτώνα των ματιών μας, το οποίο περιβάλλει το άνοιγμα της κόρης και έχει διαφορετικό για τον καθένα μας χρώμα
PWN:iron.n.01	σκληρό βαρύ μέταλλο (σύμβολο Fe), ανθεκτικό και εύκολο στην κατεργασία, που απαντά σε μεγάλες ποσότητες στη φύση (αλλά και σε μικρές ποσότητες στο αίμα και σε ορισμένες τροφές) και χρησιμοποιείται ευρύτατα για την κατασκευή εργαλείων, σκευών, μηχανημάτων κ .λπ.
PWN:iron.n.03	εργαλείο που χρησιμοποιείται για το σημάδεμα ζώων
PWN:iron_out.v.01	βελτιώνω κάτι, προσπαθώ να το φέρω σε καλύτερη κατάσταση
PWN:ironing_board.n.01	ειδική πτυσσόμενη σανίδα για το σιδέρωμα των ρούχων
PWN:irregular.a.01	αυτός που δεν είναι κανονικός και ιδίως σύμφωνος με τους κανόνες, τους κανονισμούς ή τις διατάξεις που ισχύουν
PWN:irritate.v.02	προκαλώ μη φυσιολογική αντίδραση ή ερεθισμό
PWN:island.n.01	τμήμα γης (μικρότερο από ήπειρο) που περιβρέχεται από θάλασσα
PWN:island.n.02	λόφος ή περιοχή που προεξέχει και μοιάζει με νησί
PWN:issue.n.02	τυπογραφικό φύλλο, συνήθ. δεκαεξασέλιδο, το οποίο αποτελεί μέρος ενός συγγράμματος που τυπώνεται τμηματικά
PWN:itch.n.03	η αίσθηση του κνησμού, της φαγούρας
PWN:item.n.01	κάθε χωριστό στοιχείο ενός συνόλου, το οποίο έχει τη δυνατότητα να λειτουργεί αυτόνομα
PWN:jab.v.01	βάζω κτ βαθιά, βυθίζω αντικείμενο μέσα σε άλλο αντικείμενο ή πράγμα
PWN:jacket.n.01	κοντό πανωφόρι
PWN:jacket.n.02	εξωτερική κάλυψη
PWN:jaguar.n.01	αιλουροειδές που ζει στα δάση της Αμερικής, μοιάζει με τη λεοπάρδαλη, θεωρείται μέλος της οικογένειας Felis
PWN:january.n.01	ο πρώτος μήνας του έτους και ο δεύτερος μήνας του χειμώνα (μαζί με τον Δεκέμβριο και τον Φεβρουάριο, ο οποίος αποτελείται από 31 ημέρες
PWN:jar.n.01	δοχείο με μεγάλο στόμιο (συνήθως κυλινδρικό) χωρίς χειρολαβές
PWN:jaw.n.01	το τμήμα του κρανίου των σπονδυλωτών που σχηματίζει το στόμα και κρατάει τα δόντια
PWN:jeep.n.01	επιβατικό αυτοκίνητο με ισχυρό κινητήρα, συνήθως πτυσσόμενη οροφή και κατάλληλο για ανώμαλους δρόμους
PWN:jersey.n.03	εφαρμοστή κοντομάνικη μπλούζα
PWN:jest.n.02	ενέργεια που χαρακτηρίζεται από καλό χιούμορ
PWN:jew.n.01	άτομο που ανήκει στο σημιτικό έθνος που κατοικούσε στην αρχαία Παλαιστίνη και θεωρείται ότι προέρχεται από τους απογόνους των Πατριαρχών της Βίβλου
PWN:jewel.n.01	το ορυκτό που λόγω της διαφάνειας, της λάμψης ή και της σκληρότητάς του χρησιμοποιείται για την κατασκευή κοσμημάτων ή τη διακόσμηση αντικειμένων και έχει μεγάλη αξία
PWN:jewelry.n.01	μικρών διαστάσεων αντικείμενο επεξεργασμένο με τέχνη και φαντασία, συνήθως από πολύτιμο μέταλλο και πολύτιμους ή ημιπολύτιμους λίθους, το οποίο φοριέται για στόλισμα, κυρίως από γυναίκες, στο λαιμό, στα χέρια, στα αυτιά κ.τ.λ., ως περιδέραιο, βραχιόλι, δαχτυλίδι, σκουλαρίκι κ.τ.λ.
PWN:job.n.02	δυσάρεστη και κοπιαστική εργασία, ιδίως αυτή που δεν παρέχει ηθικές απολαβές και επιβάλλεται να γίνει ως καθήκον
PWN:join.v.01	εντάσσομαι σε ομάδα ανθρώπων, που τους συνδέουν κοινές αρχές και επιδιώξεις, γίνομαι μέλος μιας οργάνωσης
PWN:join.v.02	συνδέω κτ με ένα σώμα,ώστε να ενσωματωθεί σε αυτό και να αποτελέσουν ένα όλο
PWN:join.v.04	προσεγγίζω, έρχομαι σε επαφή
PWN:joint.n.01	η σύνδεση, η συναρμογή των μελών του σώματος και το μέρος όπου αυτά ενώνονται
PWN:joint.n.05	η σύνδεση μεταξύ δύο ή περισσότερων στοιχείων
PWN:journal.n.04	υλικό αντικείμενο καταγραφής δραστηριοτήτων
PWN:journalist.n.01	συγγραφέας σε εφημερίδες και περιοδικά
PWN:journey.n.01	η μετάβαση από έναν τόπο σε άλλον, συνήθως μακρινό, με τη χρήση μέσου μεταφοράς
PWN:joy.n.01	συναίσθημα ή κατάσταση μεγάλης ευχαρίστησης και ικανοποίησης, που οφείλεται στο ότι κάποιος κατέχει ή ζει κάτι που τον ευχαριστεί πολύ
PWN:judge.n.01	αυτός που σχετίζεται με τους νόμους, με την νομική επιστήμη, του οποίου αρμοδιότητα είναι η απονομή δικαιοσύνης
PWN:judgment.n.01	η γνώμη, η άποψη που έχει διαμορφώσει κάποιος σχετικά με ένα θέμα, κρίνοντας κάτι
PWN:judgment.n.02	το αποτέλεσμα του κρίνω ή αξιολογώ
PWN:judgment.n.03	η δικαστική ετυμηγορία, η επίσημη διατύπωση της τελικής κρίσεως των δικαστικών αρχών για συγκεκριμένη υπόθεση
PWN:judgment.n.06	η διανοητική ικανότητα που χαρακτηρίζεται από την ορθή εκτίμηση γεγονότων ή καταστάσεων
PWN:judo.n.01	ιαπωνική πολεμική τέχνη που βασίζεται στο ζίου ζίτσου, δίνει έμφαση στην ταχύτητα και την ευλυγισία των αθλητών και δεν επιτρέπει τα σκληρά χτυπήματα
PWN:july.n.01	ο έβδομος μήνας του έτους
PWN:jump.n.05	πτώση, κατάβαση με αλεξίπτωτο
PWN:jump.n.06	η ενέργεια του πηδάω, του υψώνω το σώμα με γρήγορη ώθηση προς τα πάνω
PWN:jump.v.01	περπατώ πηδηχτά
PWN:juncture.n.01	η κακή, μη ευνοϊκή συγκυρία.Περιστατικό που συμβαίνει σε αποφασιστική και κρίσιμη στιγμή
PWN:june.n.01	ο έκτος μήνας του έτους
PWN:jungle.n.01	μεγάλο αδιάβατο δάσος
PWN:jurisdiction.n.02	(νομ.) το πεδίο στο οποίο μπορεί να εφαρμοστεί ο νόμος
PWN:jury.n.01	σώμα πολιτών που έχουν ορκιστεί να δώσουν μία ετυμηγορία σύμφωνα με τις αποδείξεις που παρουσιάζονται σε ένα δικαστήριο
PWN:justice.n.01	η τήρηση των αρχών του δικαίου από τα μέλη μιας κοινωνίας, που εκφράζεται με την ίση και ορθή εφαρμογή των γραπτών νόμων και με το σεβασμό των άγραφων νόμων
PWN:justification.n.01	επιχείρημα ή ισχυρισμός που προβάλλει κάποιος για να αποδείξει ως αστήρικτη μια κατηγορία ή μομφή ή για να εξηγήσει τους λόγους που τον οδήγησαν σε ένα λάθος ή σε μια παράλειψη
PWN:juvenile.n.01	νεαρής ηλικίας άτομο, νεαρό άτομο
PWN:kangaroo.n.01	μαρσιποφόρο, φυτοφάγο θηλαστικό, σύμβολο της Αυστραλιανής Ηπείρου, με μακριά λεπτά και δυνατά πίσω πόδια, που του δίνουν εξαιρετική αλτικότητα, ατροφικά μπροστινά πόδια, παχιά και δυνατή ουρά για εξισορρόπηση και στήριξη
PWN:keep.v.01	κρατώ κάτι σε καλή κατάσταση, το προστατεύω από την καταστροφή
PWN:keep.v.03	διατηρώ, κρατώ την κτήση, συγκρατώ, έχω κάτι
PWN:kernel.n.03	το κυριότερο σημείο μιας ιδέας ή υπόθεσης
PWN:kerosene.n.01	εύφλεκτο έλαιο που χρησιμοποιείται ως καύσιμο σε λάμπες και καυστήρες
PWN:kettle.n.01	μεταλλικό σκεύος, συνήθως με καπάκι , που χρησιμοποιείται  για το βρασμό υγρών
PWN:key.n.01	μικρό μεταλλικό αντικείμενο του οποίου το οδοντωτό συνήθως άκρο μπαίνει μέσα στην τρύπα της κλειδαριάς και καθώς περιστρέφεται δεξιά ή αριστερά κλειδώνει ή ξεκλειδώνει μια πόρτα, ένα συρτάρι κ.τ.λ.
PWN:key.n.05	μονάδα βάρους ή μάζας στο διεθνές σύστημα, που αντιστοιχεί σε χίλια γραμμάρια
PWN:kick.n.01	η ενέργεια του χτυπήματος με το πόδι
PWN:kick.v.01	δίνω κλοτσιά,διώχνω χτυπώντας με το πόδι
PWN:kick.v.02	δίνω κλοτσιά,διώχνω χτυπώντας με το πόδι
PWN:kick.v.03	δίνω κλοτσιά σε πρόσωπο ή πράγμα
PWN:kid.n.05	μικρής ηλικίας κατσίκα
PWN:kidnap.v.01	αρπάζω κάποιον βίαια συνήθως με σκοπό να εκβιάσω τους συγγενείς του για χρήματα
PWN:kidney.n.01	ένα από τα δύο όργανα της κοιλιακής χώρας, στο ύψος των τελευταίων οσφυϊκών σπονδύλων, τα οποία, έχουν σκούρο κόκκινο χρώμα και σχήμα φασολιού, μήκους περίπου 12 εκατοστών, διηθούν το αίμα και κατακρατούν νερό και επιβλαβείς ουσίες, με τα οποία παράγουν τα ούρα, τα οποία απομακρύνουν από τον οργανισμό μέσω του ουροποιητικού συστήματος
PWN:kill.v.01	σκοτώνω, αφαιρώ βίαια τη ζωή (κάποιου)
PWN:kill.v.10	αφαιρώ τη ζωή κάποιου από αμέλεια
PWN:killing.n.02	(νομική) κάθε σκόπιμη πράξη που έχει ως αποτέλεσμα τον θάνατο ενός προσώπου, η προμελετημένη ανθρωποκτονία
PWN:kilogram.n.01	μονάδα βάρους ή μάζας που ισούται με χίλια γραμμάρια
PWN:kin.n.01	πρόσωπο που είναι πολύ στενά δεμένο με κάπόιον άλλο, σαν οικογένεια
PWN:kin.n.02	μεγάλη πατριαρχική οικογένεια η οποία αποτελείτο από συνδεδεμένες μεταξύ τους οικογενειακές μονάδες (συνήθως με δεσμούς αίματος)
PWN:kind.n.01	μια κατηγορία που ξεχωρίζει από κάποια κοινά χαρακτηριστικά των μελών της
PWN:kindness.n.03	καλοσυνάτη πράξη
PWN:king.n.01	ανώτατος άρχοντας ενός κράτους που παίρνει την εξουσία συνήθως κληρονομικά,ηγεμόνας που κυβερνά απόλυτα ή με αρμοδιότητες που ορίζει ο νόμος
PWN:kingdom.n.03	περιφέρεια που διοικείται από έναν βασιλιά ή μια βασίλισσα
PWN:kingdom.n.06	βασικό σύνολο φυσικών αντικειμένων
PWN:kingfisher.n.01	θαλασσοπούλι με μακρύ ράμφος, που τρέφεται κυρίως με ψάρια
PWN:kinship.n.02	σχέση συγγενική μεταξύ προσώπων, π .χ. συγγένεια εξ αίματος ή αγχιστείας ή υιοθεσίας
PWN:kinsman.n.01	συγγενής αρσενικού γένους
PWN:kiss.n.01	η ενέργεια του φιλώ, το ιδιαίτερο άγγιγμα με τα χείλια (ελαφρά προτεταμένα και συνήθως μισάνοιχτα)
PWN:kitchen.n.01	δωμάτιο που είναι εξοπλισμένο για την προετοιμασία φαγητού
PWN:knead.v.01	ανακατεύω οποιαδήποτε ύλη με νερό δημιουργώντας πολτώδες, ομοιογενές μείγμα
PWN:knee.n.01	η άρθρωση του ανθρώπινου ποδιού μεταξύ μηρού και μνήμης, που του επιτρέπει να λυγίζει το πόδι.
PWN:knife.n.01	όργανο που αποτελείται από μεταλλική λεπίδα, κοφτερή στη μία ή και στις δύο ακμές της, και λαβή, χρησιμοποιείται για κάθε είδους κόψιμο ή και ως όπλο, θεωρείται δε ένα από τα πρώτα εργαλεία που κατασκεύασε ο άνθρωπος
PWN:knife.v.01	τραυματίζω ή σκοτώνω κάποιον με μαχαίρι
PWN:knight.n.01	τίτλος και αξίωμα ευγενών που μάχονταν συνήθως έφιπποι και διακρίνονταν για τη γενναιότητά τους
PWN:knight.n.02	ονομασία πιονιού που μοιάζει με άλογο στο σκάκι
PWN:knock.v.06	εκφράζω δυσμενή κρίση ή γενικά άποψη για κάποιον ή για κάτι
PWN:knot.n.02	είδος δεσίματος που σχηματίζεται στο σημείο όπου δένονται οι δύο άκρες ενός νήματος,σκοινιού κ.τ.λ. και το οποίο γίνεται τόσο σφιχτότερο,όσο πιο πολύ τεντώνουμε τις άκρες
PWN:knot.v.02	σχηματίζω κόμπο,δένω κτ σε κόμπο
PWN:know-how.n.01	η γνώση του τρόπου με τον οποίο γίνεται κάτι, οι εξειδικευμένες τεχνικές γνώσεις και πρακτικές μέθοδοι για την κατασκευή και παραγωγή προϊόντος
PWN:know.v.01	το να είναι κάποιος γνώστης, πολύ καλά ενημερωμένος για ένα γεγονός ή πληροφορία
PWN:know.v.02	αποκτώ συγκεκριμένες γνώσεις ή ιδιότητες
PWN:know.v.04	μου είναι γνωστός κάποιος ή κάτι
PWN:knowing.n.01	σύνθετη λειτουργία με την οποία ο άνθρωπος συλλαμβάνει ξεκάθαρα τη  γνώση
PWN:knowledge_domain.n.01	το κύριο σύνολο των γνώσεων, η υποδομή, οι θεμελιώδεις αρχές γνώσεων
PWN:label.n.01	μικρή επιγραφή όπου αναγράφονται σύντομες πληροφορίες
PWN:label.v.01	εντάσσω κάτι σε μία κατηγορία προσδιορίζοντας τα βασικά χαρακτηριστικά του
PWN:labor.n.02	παραγωγική δουλειά (κυρίως σωματική εργασία που γίνεται με απολαβές)
PWN:labor.v.02	καταβάλλω μεγάλη προσπάθεια, μεγάλο κόπο, κουράζομαι πολύ, δουλεύω σκληρά
PWN:lack.n.01	η κατάσταση κατά την οποία δεν υπάρχει κάτι
PWN:lacrimal_secretion.n.01	υφάλμυρο υγρό που εκκρίνεται από τους δακρυϊκούς αδένες
PWN:ladder.n.01	σκάλα φορητή (συνήθως από σχοινί αλλά και από άλλο υλικό) που αποτελείται από δύο παράλληλα τμήματα που συνδέονται με οριζόντια κομμάτια που χρησιμεύουν ως πατήματα και κρεμιέται από κάπου και αιωρείται
PWN:lady.n.01	ευγενική ονομασία για κάθε γυναίκα
PWN:lake.n.01	η κοιλότητα της γης, η οποία περιέχει στάσιμο ή ελαφρώς κινούμενο νερό και δεν επικοινωνεί με τη θάλασσα
PWN:lamb.n.01	το νεαρό πρόβατο
PWN:lamp.n.01	φωτιστικό όργανο, τεχνητή πηγή φωτός
PWN:lamp.n.02	φωτιστικό σκεύος που έχει μία ή περισσότερες ηλεκτρικές λυχνίες
PWN:land.n.01	η επιφάνεια πάνω στην οποία ζουν και κινούνται οι άνθρωποι και τα ζώα
PWN:land.n.02	το λεπτόκοκκο στρώμα που καλύπτει την επιφάνεια της γης και που προέρχεται από αποσαθρωμένα πετρώματα
PWN:land.n.04	το τμήμα της επιφάνειας της γης που δεν καλύπτεται από νερό, δεν είναι δηλαδή θάλασσα ή λίμνη
PWN:landmark.n.02	Σημείο αποφασιστικής σημασίας για κάποια εξέλιξη.Πολύ σημαντικό γεγονός
PWN:lane.n.01	στενός δρόμος ή στενή διαδρομή οδού
PWN:language.n.01	σύστημα επικοινωνίας μεταξύ των ανθρώπων, που χρησιμοποιεί τους φθόγγους για τη μετάδοση σκέψεων, γνώσεων, πληροφοριών, επιθυμιών και συναισθημάτων
PWN:language.n.05	η δυνατότητα φωνητικής επικοινωνίας
PWN:language_unit.n.01	μονάδα στην οποία μπορεί να αποδοθεί και να αναλυθεί γλωσσολογική πληροφορία
PWN:larboard.n.01	αριστερή πλευρά πλοίου ή αεροσκάφους για κάποιον που κοιτάζει την πλώρη ή το ρύγχος αεροσκάφους
PWN:larceny.n.01	η ενέργεια του κλέβω· η αφαίρεση και ιδιοποίηση πράγματος που δε μας ανήκει, πράξη που γίνεται κρυφά ή με τη βία, με δόλο ή με απάτη
PWN:large.a.01	αυτός του οποίου οι διαστάσεις υπερβαίνουν το συνηθισμένο, τον μέσο όρο ή τις διαστάσεις κάποιου
PWN:large_indefinite_quantity.n.01	ποσότητα μεγαλύτερη από τισ συνηθισμένες
PWN:larva.n.01	(ζωολ.) η ενδιάμεση (μεταξύ του εμβρύου και του τέλειου ατόμου) μορφή, με την οποία εμφανίζονται σε μια ορισμένη φάση της ανάπτυξής τους διάφορα ζώα και κυρίως έντομα
PWN:lasso.n.02	μακρύ σχοινί με θηλιά στη μία του άκρη, που χρησιμεύει στη σύλληψη ζώων
PWN:last.v.01	έχω μεγάλη διάρκεια
PWN:laud.v.01	εγκωμιάζω με ιδιαίτερη έμφαση,εξαίρω
PWN:laugh.v.01	εκφράζω ευχαρίστηση, παράγω γέλιο
PWN:laughter.n.02	η έκφραση χαράς και ευχαρίστησης ή ειρωνείας και χλευασμού
PWN:law.n.01	το σύνολο των νόμων που ισχύουν σε ένα κράτος
PWN:law.n.02	γραπτός κανόνας δικαίου που τίθεται από μια πολιτεία και που ρυθμίζει υποχρεωτικά τις σχέσεις κάθε πολίτη με την πολιτεία αυτή και με τους άλλους πολίτες
PWN:law.n.04	νόμος που περιγράφει τη σταθερή σχέση αιτίας και φαινομένου
PWN:lawman.n.01	αξιωματούχος που επιβάλλει το νόμο
PWN:lawyer.n.01	ειδικός επιστήμονας (πτυχιούχος Νομικής) που επαγγελματικά παρέχει νομικές συμβουλές και παρίσταται στα δικαστήρια ή τις αρχές για λογαριασμό άλλων
PWN:lay.v.02	απλώνω κάποιον/κάτι σε μήκος και πλάτος
PWN:layer.n.01	παχύ στρώμα ομοιογενούς ουσίας
PWN:layer.n.02	(ειδικότ.) καθετί που καλύπτει ομοιόμορφα μια συνήθως εκτεταμένη επιφάνεια
PWN:lead.n.02	χημικό στοιχείο, βαρύ μέταλλο που έχει σκούρο γκρίζο χρώμα και λιώνει εύκολα
PWN:lead.n.03	σημάδι, απόδειξη που οδηγεί σε πιθανή λύση
PWN:lead.n.09	η θέση που παίρνει ένας παίχτης του μπέιζμπολ όταν ετοιμάζεται να φύγει από μία βάση για να πάει στην επόμενη
PWN:lead.n.14	τυπογραφικό στοιχείο, ειδική πλάκα που χρησιμοποιείται στη στοιχειοθεσία, για να μεγαλώνει το διάστημα ανάμεσα σε δύο τυπογραφικές σειρές
PWN:lead.v.01	οδηγώ κάποιον, δείχνω τον δρόμο σε κάποιον, κατευθύνω προς ορισμένη κατεύθυνση
PWN:leader.n.01	αυτός που επιλέγεται ως επικεφαλής σε μια συγκροτημένη ομάδα
PWN:leadership.n.01	η άσκηση εξουσίας
PWN:leadership.n.02	το σύνολο των ατόμων που διοικούν ένα σύνολο
PWN:leadership.n.03	η εξουσία που ασκεί ο αρχηγός και το αξίωμά του
PWN:leadership.n.04	η ικανότητα που έχει κάποιος να ηγείται, να πρωτοστατεί
PWN:leaf.n.01	το βασικό όργανο της φωτοσύνθεσης και διαπνοής των φυτών. Το σύνολο των φύλλων φυτού, δέντρου.
PWN:leaf.n.02	για κάθε πλατύ και λεπτό αντικείμενο (από μέταλλο, ξύλο ή άλλο υλικό), κομμάτι χαρτιού
PWN:lean.v.01	παρεκκλίνω από την ευθεία πορεία,προχωρώ λοξά
PWN:leap.n.02	απότομη μετάβαση, (μτφ.) ταχύτατη μετάβαση από ένα στάδιο σε άλλο
PWN:leap_out.v.01	έχω σημαντικό ρόλο, ξεχωρίζω
PWN:learn.v.01	κάνω κάποιον να αποκτήσει γνώσεις ή δεξιότητες
PWN:learner.n.01	κάποιος (ειδικά παιδί) που μαθαίνει από δάσκαλο
