id	Definition
PWN:puberty.n.01	περίοδος της ζωής του ανθρώπου, που αποτελεί μεταβατικό στάδιο ανάμεσα στην παιδική ηλικία και στην ωριμότητα και που αρχίζει με την εμφάνιση της ήβης και τελειώνει με την πλήρη σωματική και ψυχολογική ωρίμανση του ατόμου
PWN:pubic_hair.n.01	το τρίχωμα που αναπτύσσεται στην περιοχή της ήβης
PWN:public.a.01	αυτός που αναφέρεται στο κοινωνικό σύνολο
PWN:public_opinion.n.01	η άποψη που επικρατεί σε μεγάλο μέρος των μελών μιας κοινωνίας για συγκεκριμένο κοινωνικό θέμα, η συλλογική στάση του κοινωνικού συνόλου
PWN:public_square.n.01	ανοιχτός κοινόχρηστος χώρος που σχηματίζεται στο σημείο όπου τέμνονται δύο ή περισσότεροι δρόμοι, ειδικά διαμορφωμένος, ώστε να μπορεί ο κόσμος να κάθεται, να κάνει περίπατο ή να παίζουν τα παιδιά
PWN:public_transport.n.01	τα μέσα που χρησιμοποιούνται για τη μετακίνηση προσώπων ή πραγμάτων από τόπο σε τόπο
PWN:publication.n.01	το σύνολο των αντιτύπων ενός τυπωμένου έργου που προέρχονται από την ίδια στοιχειοθεσία και προορίζονται για διανομή
PWN:puffball.n.01	μανιτάρι γένους lycoperdaceae
PWN:puissance.n.01	η ορμή σε συνδυασμό με το βάρος κάποιου, η σφοδρότητα, η ισχύς
PWN:pull.n.01	η ενέργεια του τραβώ, του βάζω δύναμη για να κινήσω κάτι μαζί μου
PWN:pull.v.01	χαράσσω,σύρω
PWN:pull.v.08	τεντώνω ανώμαλα
PWN:pulley.n.01	ξύλινος, μεταλλικός ή πλαστικός κύλινδρος ή κώνος γύρω από τον οποίο τυλίγεται νήμα, κλωστή ,σύρμα, ταινία, φιλμ
PWN:pulsate.v.01	κουνώ αργά και ρυθμικά το σώμα μου
PWN:pulsation.n.01	(στην ηλεκτρονική) στιγμιαία ταλάντωση κυκλώματος
PWN:punch.v.03	τρυπώ πέρα ως πέρα
PWN:punctuate.v.01	βάζω τόνους
PWN:punish.v.01	επιβάλλω τιμωρία σε κάποιον
PWN:punishment.n.01	η ενέργεια του ποινικοποιώ
PWN:pup.n.01	το νεαρό, το μικρό κάποιων σαρκοφάγων (σκύλος, τίγρης, λυκος κτλ.)
PWN:pursue.v.02	κυνηγώ (κάποιον) για να τον συλλάβω
PWN:pursuit.n.01	η δίωξη ανθρώπου ή ζώου, ακολουθώντας τα ίχνη ή την πορεία του με σκοπό τη σύλληψη
PWN:pus.n.02	υγρό, συνήθως αδιαφανές, κιτρινωπό και παχύρρευστο, το οποίο δημιουργείται σε σημεία που υπάρχει φλεγμονή και αποτελείται από κατεστραμμένα λευκοκύτταρα και άλλους μικροοργανισμούς
PWN:push.n.01	το σπρώξιμο, η εφαρμογή δύναμης με αποτέλεσμα την κίνηση
PWN:push.v.01	μετακινώ με δύναμη
PWN:put.v.01	αφήνω, βάζω κάτι (που μπορώ να το σηκώσω) σε ένα μέρος προσωρινά, τοποθετώ πρόχειρα, βάζω σε συγκεκριμένο μέρος
PWN:put_on.v.07	απλώνω κάτι επάνωσε μία επιφάνεια
PWN:put_up.v.08	προσφέρω ποσό κυρίως μετέχοντας σε συλλογική προσπάθεια και στο βαθμό που μου αναλογεί
PWN:pyramid.n.01	γεωμετρικό στερεό που αποτελείται από ένα επίπεδο πολύγωνο( βάση )και από τρίγωνα( παράπλευρες έδρες )που έχουν βάσεις τις πλευρές του πολυγώνου και κοινή κορυφή
PWN:python.n.01	είδος βόων
PWN:quail.n.02	αποδημητικό πτηνό που συγγενεύει με την πέρδικα και έχει νόστιμο κρέας
PWN:qualify.v.01	είμαι ικανός για κάτι, μου είναι εύκολο
PWN:qualify.v.06	προσδιορίζω τα χαρακτηριστικά γνωρίσματα, τις ιδιαιτερότητες προσώπου, πράγματος (γεγονότος, κατάστασης)
PWN:quality.n.01	ουσιώδες χαρακτηριστικό κάποιου ατόμου ή κάποιου πράγματος
PWN:quality.n.03	χαρακτηριστική ιδιότητα που καθορίζει την φαινομενική μορφή κάποιου πράγματος
PWN:quantify.v.02	καταγράφω με ακρίβεια τις ενδείξεις των μετρητών( ρεύματος ,νερού κ.λπ.)
PWN:quantity.n.03	κάτι που έχει όγκο, μάζα και μπορεί να συμβολιστεί σε μαθηματικές αναπαραστάσεις με μια σταθερά ή μεταβλητή
PWN:quarrel.n.01	λεκτική σύγκρουση,διαμάχη
PWN:quarrel.v.01	ανταλλάσσω με κάποιον ή με κάποιους έντονα εχθρικά ή και υβριστικά λόγια
PWN:quarter.n.04	περίοδος παιχνιδιού
PWN:quarter.n.06	χρονικό διάστημα τριών μηνών
PWN:queen.n.01	το μόνο γόνιμο θηλυκό αποικίας εντόμων (π .χ. μυρμηγκιών, μελισσών)
PWN:question.n.01	πρόταση που φανερώνει απορία ή άγνοια για ορισμένο ζήτημα και επιζητεί απάντηση ή διευκρίνηση
PWN:questioning.n.01	αναζήτηση πληροφοριών με ιδιαίτερο ενδιαφέρον
PWN:quota.n.01	συγκεκριμένο ποσοστό αριθμητικής ή ποσοτικής αναλογίας
PWN:quote.v.01	(στο γραπτό λόγο) αναφέρω, επαναλαμβάνω αυτούσιο το κείμενο (ή αποσπάσματα) ενός συγγραφέα μέσα σε δικό μου κείμενο
PWN:rabbit.n.01	μικρόσωμο φυτοφάγο θηλαστικό με μακριά αυτιά, που συγγενεύει με το λαγό, χαρακτηρίζεται από υπεργεννητικότητα και εκτρέφεται για το κρέας του
PWN:rabbit.n.03	το κουνέλι χρησιμοποιούμενο ως τροφή, φαγητό
PWN:rabble.n.02	πλήθος αμφίβολης αξίας ή ήθους ατόμων
PWN:raccoon.n.02	παμφάγο θηλαστικό με ρωμαλέο σώμα, φουντωτή ραβδωτή ουρά, πυκνό τρίχωμα, και καφέ αποχρώσεις. Προέρχεται από την Βόρεια και κεντρική Αμερική
PWN:race.n.01	κάθε συστηματική κινητοποίηση για την πραγματοποίηση στόχου
PWN:race.n.02	διαγωνισμός ταχύτητας
PWN:race.n.03	άνθρωποι που πιστεύεται ότι ανήκουν στο ίδιο γενετικό υλικό
PWN:rack.n.01	βάση που χρησιμοποιείται ως στήριγμα για κάποια αντικείμενα
PWN:radiate.v.05	βγάζω προς τα έξω φως, ακτινοβολώ
PWN:radiation.n.01	(φυσ.) η διαδικασία με την οποία εκπέμπεται ενέργεια υπό μορφήν ακτίνων, δηλ. κατά δέσμες σωματιδίων ή κατά κύματα
PWN:radio_receiver.n.01	η συσκευή που χρησιμοποιείται για τη μετάδοση σημάτων μέσω των ηλεκτρομαγνητικών κυμάτων της ατμόσφαιρας
PWN:raft.n.01	πρόχειρο πλωτό μέσο κατασκευασμένο από κορμούς δέντρων δεμένους σε παράλληλη σειρά ή από σανίδες στηριγμένες επάνω σε κενά δοχεία, όπως βαρέλια, που κινείται με πανί ή με κουπιά
PWN:rag.n.01	ύφασμα πολύ φθαρμένο, σκισμένο ή παλιό, χωρίς γερή και ενιαία ύφανση
PWN:railroad_track.n.01	οδός επικοινωνίας, στρωμένη με παράλληλες ράβδους πάνω στις οποίες κινείται ατμοκίνητη ή ηλεκτροκίνητη αμαξοστοιχία
PWN:railway.n.01	σύστημα μεταφοράς που αποτελείται από βαγόνια και κινείται πάνω σε σιδηροτροχιές
PWN:rain.n.01	νερό που συμπυκνώνεται από υγροποιημένους ατμούς στην ατμόσφαιρα και πέφτει στη γη σε σταγόνες, πτώση του νερού από τα σύννεφα στη γη με μορφή σταγόνων
PWN:rain.v.01	(απροσ.) πέφτει βροχή
PWN:rainbow.n.01	τόξο χρωμάτων που σχηματίζεται στον ουρανό από τις ακτίνες του ήλιου μετά τη βροχή
PWN:raise.n.01	η παροχή μεγαλύτερου μισθού
PWN:raise.v.01	δίνω σε κάτι  επιπλέον ύψος
PWN:raise.v.02	σηκώνω κάτι από μια χαμηλότερη σε μια ψηλότερη θέση
PWN:raise.v.19	επαναφέρω στην επικαιρότητα ένα ζήτημα, για να συζητηθεί και για να δοθεί ενδεχομένως κάποια λύση
PWN:ram.n.05	το αρσενικό πρόβατο
PWN:range.n.04	σειρά βουνών
PWN:range.n.05	στρατιωτικός χώρος για άσκηση πυροβολισμών και ρίψη βλημάτων
PWN:rank.n.02	αναφορική θέση, τάξη
PWN:rant.v.01	λέω φλυαρίες
PWN:rat.n.01	ο μεγαλύτερος σε μέγεθος ποντικός των αγρών που ζει στα χωράφια και στις αποθήκες ή τα υπόγεια των αγροτικών περιοχών και προκαλεί ζημιές στις καλλιέργειες
PWN:rate.v.01	αξιολογώ με βαθμό κάποια επίδοση
PWN:rate.v.02	(ως απρόσ. αξίζει) έχει αξία, σημασία (να γίνει κάτι)
PWN:ratio.n.01	(και στον πληθυντικό οι αναλογίες) σχέση (συμμετρική ή μη) ανάμεσα στις διαστάσεις των μερών ενός όλου
PWN:rattle.v.01	παράγω έντονο ήχο χτυπώντας κρόταλα ή παρόμοιο ήχο με αυτόν που κάνουν τα κρόταλα όταν χτυπούν
PWN:raven.n.01	σαρκοφάγο πουλί με μαύρο φτέρωμα, σκληρό ράμφος και χαρακτηριστική τραχιά φωνή
PWN:raw_material.n.01	κάθε υλικό κατάλληλο για κατασκευή ή χρήση
PWN:razor.n.01	μικρή, μακρόστενη και λεπτή μεταλλική πλάκα, πολύ κοφτερή από τη μια της πλευρά, η οποία χρησιμεύει στο ξύρισμα
PWN:re-create.v.01	αναδημιουργώ, αναπλάθω
PWN:reach.v.01	έρχομαι,καταλήγω στο τέρμα,εκεί όπου κατευθύνομαι
PWN:reach.v.06	έχω ή καταλαμβάνω μεγάλο χώρο, ορισμένη επιφάνεια, μήκος, πλάτος κτλ .· απλώνομαι
PWN:react.v.02	έχω αντίθετη άποψη, διαφωνώ
PWN:reaction.n.03	αντίδραση που έχει ως σκοπό την αντιμετώπιση μιας εχθρικής ενέργειας ή μιας δυσάρεστης κατάστασης, οτιδήποτε έρχεται ως απάντηση σε επίδραση
PWN:reaction.n.07	η ενέργεια του να πράττει κάποιος κάτι με τέτοιο τρόπο, ως εναντίωση ή αντίθεση προς κάποιον άλλο
PWN:read.v.01	μεταφράζω κάτι που είναι γραμμένο ή τυπωμένο
PWN:read.v.03	απαγγέλλω, διαβάζω μεγαλόφωνα
PWN:read.v.04	διαβάζω κείμενο με ηλεκτρονική συσκευή ανάγνωσης κειμένου
PWN:read.v.10	αντιλαμβάνομαι σε βάθος, καταλαβαίνω ξεκάθαρα
PWN:reading.n.03	το αποτέλεσμα της μέτρησης που παίρνουμε από ένα όργανο, ένα μετρητή, μια συσκευή κ.τ.λ.
PWN:real_property.n.01	ιδιοκτησία γης και ακινήτων
PWN:realization.n.02	η εφαρμογή στην πράξη, η υλοποίηση, το να γίνει κάτι πραγματικότητα
PWN:realize.v.03	κάνω κάτι που υπάρχει ως σκέψη, πρόταση, θεωρία να αποκτήσει υλική υπόσταση, να πραγματοποιηθεί
PWN:reap.v.01	συγκεντρώνω σοδειά σε ένα μέρος
PWN:rear.n.02	η πλευρά ενός αντικειμένου που είναι η αντίθετη του μπροστά
PWN:rear.n.05	το πίσω μέρος επιφάνειας
PWN:reason.n.03	η ικανότητα να σχηματίζει, να διακρίνει και να συσχετίζει κανείς έννοιες μεταξύ τους με βάση αρχές ή νόμους της λογικής
PWN:reason.v.03	έχω την ικανότητα της λογικής σκέψης
PWN:reasoning.n.01	σκέψη που έχει ειρμό και είναι λογική
PWN:rebellion.n.02	η έμπρακτη και δυναμική άρνηση ενός συνόλου ή ομάδας, με στρατιωτική συνήθως οργάνωση, να υπακούσει σε ανώτερη αρχή
PWN:rebuff.n.01	σκόπιμη, υβριστική ενέργεια, συνήθως ως έκφραση θυμού ή αποδοκιμασίας
PWN:receive.v.01	"δέχομαι, παίρνω κάτι από κάποιον, είμαι ο παραλήπτης, π.χ. ""Έλαβα το δέμα, το γράμμα, την επιταγή"""
PWN:receive.v.02	συναντώ, δέχομαι (κάτι που μου απευθύνεται), δέχομαι ιδιαίτερη μεταχείριση
PWN:reception.n.04	η ενέργεια του λαμβάνω
PWN:recess.n.04	το σημείο μιας επιφάνειας, στο οποίο δημιουργείται κοιλότητα προς τα μέσα
PWN:reciprocality.n.01	σχέση αλληλεξάρτησης ή αμοιβαίας επίδρασης
PWN:recite.v.02	διαβάζω δυνατά ή λέω από μνήμης
PWN:recognize.v.02	έχω αντίληψη ενός πράγματος, γνωρίζω καλά
PWN:recognize.v.04	αντιλαμβάνομαι, αποδέχομαι κάτι ως ίδιο
PWN:recognize.v.09	δείχνω έγκριση
PWN:recommend.v.01	ωθώ, ενθαρρύνω κάποιον ώστε να προβεί σε συγκεκριμένη ενέργεια
PWN:recompense.n.01	αμοιβή για προσφερθείσα υπηρεσία
PWN:reconcile.v.03	πετυχαίνω την ομαλή συνύπαρξη καταστάσεων ή απόψεων
PWN:record.n.01	οτιδήποτε παρέχει μαρτυρίες ή πληροφορίες για τα γεγονότα του παρελθόντος
PWN:record.n.05	τα γνωστά γεγονότα σε σχέση με κάτι ή κάποιον
PWN:record.n.06	το ανώτατο όριο μιας αθλητικής επίδοσης, η επιτυχία που ξεπερνά κάθε προηγούμενη
PWN:record.n.07	συλλογή γραπτών κυρίως ντοκουμέντων (κρατικών ή ιδιωτικών) που χρησιμεύουν για την ανάμνηση ή την τεκμηρίωση γεγονότων
PWN:record.v.01	καταγράφω με αναλυτικό τρόπο στοιχεία
PWN:recover.v.01	αποκτώ πάλι κάτι που είχα χάσει
PWN:recovery.n.03	η ενέργεια του ανακτώ κάτι που κάποτε το κατείχα και είχε χαθεί ή μου είχε αφαιρεθεί
PWN:recruit.v.02	παίρνω κάποιον στη δουλειά
PWN:recuperate.v.04	συνέρχομαι από αρρώστια, ανακτώ τις δυνάμεις μου
PWN:recur.v.01	(συνήθως σε τρίτο πρόσωπο) κάτι που γίνεται ή συμβαίνει ξανά
PWN:recurrence.n.01	εμφάνιση ξανά κάποιου ατόμου ή πράγματος, το να συμβεί κάτι ξανά
PWN:reduce.v.01	καταλήγω σε κατάσταση ή μορφή υποδεέστερη της αρχικής
PWN:reduce.v.18	μειώνω σε όγκο σε βρασμό
PWN:reduce.v.20	χάνω βάρος
PWN:reek.v.02	αναδίδω απωθητική,δυσάρεστη οσμή
PWN:reference.n.07	το να αναφέρεις
PWN:reference_book.n.01	βιβλίο χρήσιμο για γενικότερη πληροφόρηση (λεξικό, εγκυκλοπαίδεια κ.λπ.) ή και για ειδική πληροφόρηση (γραμματική, εγχειρίδια διαφόρων επιστημόνων), από το οποίο αντλεί ο χρήστης συγκεκριμένες έγκυρες πληροφορίες
PWN:reflector.n.01	επιφάνεια που μεταβάλλει την πορεία διαφόρων τύπων ακτινοβολίας, λειτουργώντας ως φράγμα
PWN:reform.n.01	η αλλαγή και τροποποίηση προς το καλύτερο
PWN:refund.v.01	εξοφλώ κατι που χρωστάω, επιστρέφω χρήματα σε κάποιον
PWN:refuse.v.01	δεν αποδέχομαι, δεν δέχομαι, αρνούμαι
PWN:refuse.v.02	δεν αποδέχομαι
PWN:refute.v.01	αντιμετωπίζω με επιτυχία κάτι ανασκευάζοντάς το
PWN:region.n.01	ορισμένο τμήμα του ευρύτερου χώρου
PWN:region.n.03	μια μεγάλη απροσδιόριστη έκταση στην επιφάνεια της γης
PWN:register.n.03	επίσημος κατάλογος, ιδίως προσώπων, που έχουν ορισμένο κοινό χαρακτηριστικό
PWN:register.v.01	καταχωρώ σε κατάλογο, μητρώο, ειδικό πίνακα
PWN:registration.n.01	η ενέργεια του εγγράφω
PWN:regular.a.01	αυτός που είναι σύμφωνος με ένα πρότυπο, με ένα υπόδειγμα, που δεν παρουσιάζει αποκλίσεις από αυτό. Αυτός που είναι σύμφωνος με τους ισχύοντες νόμους, διατάξεις ή συνήθειες, που προβλέπεται από αυτούς ή που δεν αποτελεί εξαίρεση σε ό,τι ισχύει συνήθως
PWN:regular_payment.n.01	πληρωμή που γίνεται σε τακτά χρονικά διαστήματα
PWN:regularity.n.02	η ιδιότητα του κανονικού. Η ύπαρξη κανόνων και η τήρησή τους
PWN:regularize.v.02	επαναφέρω κάτι σε κατάσταση ομαλότητας, κάνω κάτι (πάλι) ομαλό, έτσι ώστε να μπορεί να λειτουργεί ή να εξελίσσεται κανονικά
PWN:regulate.v.02	επιβάλλω κανόνες και εξουσιάζω
PWN:regulation.n.06	ο έλεγχος, ο συντονισμός σύμφωνα με κανόνες
PWN:rehearse.v.01	συμμετέχω σε παρασκευαστική και δοκιμαστική εκτέλεση έργου πριν από τη δημόσια και επίσημη παρουσίαση στο κοινό
PWN:reject.v.01	δεν αποδέχομαι κάτι ή κάποιον, δε συμφωνώ με κάτι ή κάποιον, δεν το(ν) θεωρώ σωστό ή ακατάλληλο
PWN:rejection.n.01	η ενέργεια του να απορρίπτω κάτι
PWN:rejoice.v.01	αισθάνομαι χαρά,είμαι χαρούμενος,πολύ ευχαριστημένος ή ενθουσιασμένος
PWN:relate.v.04	έχω σχέση ή συγγένεια με κάποιον
PWN:relate.v.05	για κάτι που έχει σχέση, που συνδέεται με κάποιον  ή με κάτι
PWN:relatedness.n.01	η συσχετιστική σύνδεση
PWN:relation.n.01	η ιδιότητα δύο ή περισσότερων αντικειμένων της σκέψης, τα οποία μπορούν να περιληφθούν σε μια μοναδική διανοητική πράξη
PWN:relationship.n.01	"συχνά χρησιμοποιείται για να δηλώσει προσωπικές σχέσεις ή συγγενικές, π.χ. ""η σχέση ανάμεσα στην ανεργία και τον πληθωρισμό"""
PWN:relationship.n.02	"σχέση που συνδέει άτομα (ειδικότερα η ερωτική σχέση), π .χ. ""είχαν σχέση εδώ και τρία χρόνια, αλλά όλοι νόμιζαν ότι ήταν απλώς φίλοι""."
PWN:relationship.n.03	κατάσταση που συνεπάγεται αμοιβαίες δοσοληψίες ανάμεσα σε άτομα ή παρατάξεις ή κράτη, επιχειρήσεις κ.τ.λ.
PWN:relative.n.01	αυτός που συνδέεται με κάποιον με σχέσεις (βιολογικής ή θεσμικής) συγγένειας
PWN:relative_quantity.n.01	σχετική ποσότητα από κάτι
PWN:relax.v.01	γίνομαι χαλαρός
PWN:relay.n.04	αγώνισμα ανάμεσα σε δύο ή περισσότερες (συνήθως τέσσερις) ομάδες, κατά το οποίο ο κάθε αθλητής διανύει ένα ορισμένο τμήμα της όλης απόστασης παραδίνοντας τη σκυτάλη στον επόμενο αθλητή της δικής του ομάδας που τον περιμένει στο τέρμα της επί μέρους διαδρομής
PWN:release.n.09	ενέργεια που απελευθερώνει δημιουργικό συναίσθημα ή συναίσθημα
PWN:release.v.08	εγκαταλείπω εκούσια αξίωμα, ιδιότητα ή δικαιώματα που είχα
PWN:relevance.n.01	η σχέση κάποιου πράγματος με το προκειμένο θέμα
PWN:relief.n.05	προσφορά βοήθειας σε κάποιον σε δύσκολες στιγμές
PWN:relieve.v.01	καταπραϋνω, μειώνω τους σωματικούς ή ψυχικούς πόνους, απαλάσσω κάποιον από αυτούς
PWN:religion.n.01	πίστη σε μια υπερφυσική δύναμη που ελέγχει την ανθρώπινη ύπαρξη
PWN:religion.n.02	θεσμός για την έκφραση πίστης σε θεϊκή οντότητα
PWN:religious_ceremony.n.01	σύνολο πράξεων ιεράς λατρείας
PWN:religious_holiday.n.01	αργία που έχει καθιερωθεί για τον εορτασμό των αγίων ή μεγάλων θρησκευτικών γεγονότων της εκκλησίας
PWN:religious_person.n.01	που έχει βαθύτατη πίστη και τηρεί με ευλάβεια τους κανόνες της θρησκείας του
PWN:remainder.n.01	κάτι που απομένει αφού άλλα μέρη αποσπώνται
PWN:remains.n.01	το τμήμα ενός συνόλου, που έχει μείνει ως υπόλοιπο (χρήσιμο ή όχι)
PWN:remark.n.01	η απλή κατονομασία, η ονομαστική παράθεση
PWN:remedy.n.02	ένα φάρμακο ή μια θεραπεία που θεραπεύει μια αρρώστια ή απαλύνει τον πόνο
PWN:remember.v.01	διατηρώ ή επαναφέρω στη μνήμη μου παραστάσεις από πρόσωπα, γεγονότα ή πράγματα που ανήκουν σε μια εμπειρία του παρελθόντος
PWN:remember.v.02	"διατηρώ στη μνήμη μου, θυμάμαι, π.χ. ""θυμήσου να τηλεφωνείς κάθε μέρα""."
PWN:remember.v.03	επαναφέρω στη μνήμη μου συνήθως νοσταλγικά (πρόσωπα, γεγονότα, περίοδο από το παρελθόν), αναπολώ
PWN:remember.v.04	ανακαλώ στη μνήμη των άλλων, αναφέρω
PWN:remove.v.01	μεταφέρω μακριά, κάνω (κάποιον,κάτι) να πάει μακριά, μετακινώ κάτι συγκεκριμένο, απτό ή κάτι αφηρημένο
