id	Definition
PWN:cushion.n.03	μαλακός σάκος, αντικείμενο κατασκευασμένο συνήθως από ύφασμα και γεμισμένο με αέρα ή μαλακό υλικό, το οποίο χρησιμοποιείται για τη στήριξη διάφορων μερών του σώματος, όταν ο άνθρωπος κάθεται, ή του κεφαλιού, όταν αυτός είναι ξαπλωμένος
PWN:custom.n.01	ενέργεια που με τη συχνή επανάληψη έχει κατά κάποιο τρόπο τυποποιηθεί
PWN:cut.n.01	μερίδιο από τα κέρδη
PWN:cut.n.04	(μτφ) για διαβάθμιση σε ιεραρχική κλίμακα
PWN:cut.n.06	κομμάτι από κρέας
PWN:cut.n.16	η ενέργεια του διατρυπώ ή ανοίγω άνοιγμα με αιχμηρή κόψη
PWN:cut.v.01	με κατάλληλο όργανο ή εργαλείο διαιρώ ένα στερεό σώμα σε μικρότερα κομμάτια
PWN:cut_off.v.03	αφαιρώ κόβοντας, κόβω τμήμα από ενιαίο σώμα
PWN:cutter.n.06	εργαλεία, όργανα για κόψιμο
PWN:cutting_implement.n.01	εργαλείο που χρησιμοποιείται για κόψιμο
PWN:cylinder.n.01	στερεό αντικείμενο με κυλινδρική επιφάνεια και δυο παράλληλες πλευρές,βάσεις
PWN:dab.v.02	χτυπώ ελαφρά
PWN:dada.n.02	μηδενιστικό καλλιτεχνικό κίνημα που άνθισε στην Ευρώπη στις αρχές του 20ου αιώνα, βασιζόμενο στο παράλογο και στην άρνηση των καθιερωμένων κανόνων της ομορφιάς
PWN:dainty.n.01	νόστιμο, εκλεκτό φαγητό ή γλύκισμα που είναι ιδιαίτερα ευχάριστο στη γεύση
PWN:dairy_product.n.01	γάλα, βούτυρο και τυρί, οτιδήποτε παράγεται από γάλα
PWN:dam.n.01	τεχνικό έργο που αποσκοπεί στη συγκράτηση της ροής ή στην αποθήκευση υδάτων
PWN:damage.n.01	το αποτέλεσμα του εξασθενίζω, αλλαγή προς το χειρότερο
PWN:damage.n.03	η ενέργεια του τραυματίζω κάποιον ή προκαλώ ζημιά σε κάτι
PWN:damage.v.01	προξενώ ζημιά, φθείρω
PWN:dame.n.02	καλλιεργημένη γυναίκα, αρχοντική κυρία, γυναίκα αξιοπρεπής ή υψηλής κοινωνικής θέσης που συμπεριφέρεται με ευγένεια και σοβαρότητα ή που διαθέτει κύρος
PWN:dance.v.01	κινούμαι ζωηρά κάνοντας σχηματισμούς
PWN:dance.v.02	κινούμαι σε σχεδιασμό, συνήθως με τη συνοδεία μουσικής
PWN:dance_band.n.01	γκρουπ μουσικών που παίζουν λαϊκή μουσική κατάλληλη για χορό
PWN:dance_step.n.01	χορευτικός βηματισμός
PWN:dancing.n.01	το σύνολο των βημάτων και κινήσεων σύμφωνα με το ρυθμό της μουσικής
PWN:danger.n.01	η κατάσταση του να κινδυνεύεις να πάθεις κάτι κακό
PWN:danger.n.03	αιτία πόνου ή απώλειας ή ατυχήματος
PWN:danger.n.04	επικίνδυνη περιοχή
PWN:dare.v.02	έχω το θάρρος και τη γενναιότητα να προσπαθήσω ή να κάνω κάτι
PWN:dark.n.01	η απουσία φωτός
PWN:darken.v.01	γίνομαι σκούρος ή σκουρότερος
PWN:dart.v.02	κινούμαι ή ενεργώ με ταχύτητα και προθυμία
PWN:data.n.01	συλλογή γεγονότων, πράξεων απ' όπου συμπεράσματα μπορούν να εξαχθούν
PWN:data_processing.n.01	η προσωρινή κράτηση στοιχείων σε έναν επεξεργαστή κατά τη διάρκεια εκτέλεσης υπολογισμών ή λογικών πράξεων σ' αυτόν
PWN:database.n.01	ένα οργανωμένο σύνολο σχετικών πληροφοριών
PWN:date.n.01	η συγκεκριμένη ημέρα ενός μήνα, κατά την οποία συμβαίνει κάτι
PWN:date.n.08	ο καρπός της χουρμαδιάς
PWN:date.v.01	έχω επαφή επικοινωνία με κάποιον, βγαίνω ραντεβού με κάποιον
PWN:datum.n.01	στοιχείο που παρέχει πληροφορίες και προέρχεται από κάποια μέτρηση ή έρευνα
PWN:daub.v.03	καλύπτω επιφάνεια με ρευστή ουσία
PWN:daughter.n.01	θηλυκό παιδί
PWN:dawn.n.02	(μτφ.) η πρώτη εμφάνιση,το φανέρωμα μιας αρχής
PWN:dawn.v.03	(συνήθως γ' πρόσωπο) αρχίζει να ξημερώνει
PWN:day.n.01	ο χρόνος που χρειάζεται η γη για να κάνει μία πλήρη περιστροφή γύρω από τον άξονά της
PWN:day.n.02	κάποιο χρονικό σημείο ή χρονική περίοδος
PWN:day.n.03	εικοσιτετράωρο που αφιερώνεται σε συγκεκριμένο σκοπό (δραστηριότητα, εορτασμό, κτλ.)
PWN:day.n.05	το χρονικό διάστημα κατά το οποίο δεν κοιμόμαστε και συνήθως εργαζόμαστε
PWN:day.n.06	διάστημα στο οποίο έζησε κάποιος και άσκησε μεγάλη επιρροή
PWN:day.n.07	ο χρόνος που χρειάζεται οποιοδήποτε ουράνιο σώμα (π .χ. ο Άρης), για να επιτελέσει μια πλήρη περιστροφή γύρω από τον άξονά του
PWN:day.n.09	περίοδος ευκαιρίας
PWN:daybook.n.02	σύνολο φύλλων χαρτιού καλυμμένων με εξώφυλλα και συρραμμένων στη μία πλευρά, που προορίζονται για καταγραφή λογαριασμών, πρακτικών συνεδρίων· λογιστικό βιβλίο, βιβλίο πρακτικών κ.λπ.
PWN:daze.n.01	κλονισμός που οφείλεται σε κάποιο ξαφνικό και συνήθως δυσάρεστο γεγονός
PWN:dead.a.01	αυτός που έχει πεθάνει, που δεν έχει ζωή
PWN:deaden.v.06	κάνω κάτι αδύναμο, ασθενικό ή λιγότερο έντονο
PWN:deadline.n.01	καθορισμένο χρονικό διάστημα μέσα στο οποίο πρέπει να γίνει, να διακπεραιωθεί κάτι
PWN:death.n.01	το γεγονός του θανάτου, η αποχώρηση από τη ζωή
PWN:death.n.02	το οριστικό τέλος κάθε ζωτικής λειτουργίας σε έναν οργανισμό ή σε τμήμα ενός οργανισμού
PWN:deathrate.n.01	ο αριθμός των θανάτων σε μια περιοχή σχετικά με τον πληθυσμό της περιοχής αυτής
PWN:debate.v.03	συζητώ τα υπέρ και τα κατά ενός θέματος
PWN:debt.n.02	χρηματικό ποσό που έχουμε υποχρέωση να πληρώσουμε ή να επιστρέψουμε σε κάποιον
PWN:decade.n.01	περίοδος 10 ετών
PWN:decapitate.v.01	σκοτώνω κάποιον κόβοντάς του το κεφάλι
PWN:decay.n.01	η διαδικασία της σταδιακής αλλαγής προς το χειρότερο
PWN:decay.n.04	κατάσταση που απορρέει από τη διαδικασία του παρακμάζειν, σταδιακή απώλεια δύναμης ή αξίας
PWN:deceive.v.01	παραπλανώ, εξαπατώ, ξεγελώ, επωφελούμαι από την αφέλεια ή την ευκολοπιστία κάποιου και με δόλο τον κάνω να πιστέψει αυτό που επιδιώκω
PWN:december.n.01	ο δωδέκατος μήνας του έτους και ο πρώτος του χειμώνα (μαζί με τον Ιανουάριο και τον Φεβρουάριο), ο οποίος έχει 31 ημέρες
PWN:deception.n.02	ενέργεια, τρόπος, μέσον εξαπάτησης.
PWN:decide.v.01	καταλήγω σε απόφαση, διαμορφώνω τελική κρίση για την πραγμάτωση συγκεκριμένου στόχου
PWN:decide.v.02	καταλήγω τελικά σε κάτι σχετικά με κάποιο θέμα ή σχετικά με τον τρόπο που θα ενεργήσω
PWN:decision.n.01	η ενέργεια ή το αποτέλεσμα του αποφασίζω,  η κατάληξη σε μία επιλογή, γνώμη
PWN:decision.n.03	(αθλητικούς αγώνες)ο πρόσθετος χρόνος του αγώνα σε περίπτωση που δεν έχει αναδειχθεί νικητής
PWN:decision.n.04	η έκβαση ενός παιχνιδιού ή ενός διαγωνισμού
PWN:decision_making.n.01	η γνωστική διαδικασία που καταλήγει σε επιλογή, σε κάποια απόφαση
PWN:declaration.n.01	σαφή, κατηγορηματική ή συγκεκριμένη δήλωση, ανακοίνωση
PWN:declare.v.04	εκφράζω κάτι  ενώπιον κάποιων επίσημα
PWN:declared.s.02	που έχει γίνει δεκτό σαν αδιαμφισβήτητο γεγονός, ρητά δηλωμένο
PWN:decline.n.01	η αλλαγή προς το χειρότερο
PWN:decorate.v.01	βελτιώνω την εμφάνιση, κάνω αισθητικά ευχάριστο και ελκυστικό
PWN:decoration.n.01	ό ,τι είναι κατάλληλο για να στολίσει κάτι, συνήθως  για διακοσμητικά αντικείμενα
PWN:decoration.n.03	η διαδικασία στολισμού ενός χώρου, ο τρόπος διατάξεως των διαφόρων στοιχείων του για τη δημιουργία ενός αισθητικά αρμονικού συνόλου
PWN:decrease.n.01	η καθοδική πορεία, η ραγδαία μείωση
PWN:decrease.n.02	η διαδικασία μείωσης, ελάττωσης
PWN:decrease.n.04	η ελάττωση, η μείωση
PWN:decrease.v.01	κάνω κάτι να γίνει λιγότερο ή μικρότερο
PWN:decrease.v.02	κάνω κάτι μικρότερο ή λιγότερο, π.χ. μείωσε το προσωπικό του
PWN:decree.n.01	χαρακτηρισμός ή ονομασία διαταγών της εκτελεστικής εξουσίας
PWN:deem.v.01	θεωρώ κάποιον ή κάτι, εκτιμώ ή αξιολογώ (ως)
PWN:deer.n.01	κατηγορία ζώων που διακρίνεται από τα βοοειδή, κυρίως γιατί τα αρσενικά φέρουν οστέινες εκφύσεις στο μέτωπο που διακλαδίζονται σε διάφορα σχήματα
PWN:defeat.n.01	δυσμενής έκβαση για κάποιον σε οποιονδήποτε αγώνα ή αναμέτρηση (πολιτική, κοινωνική, ιδεολογική κ.τ.λ.)
PWN:defect.n.03	ατέλεια, ελάττωμα, πρόβλημα στην κατασκευή ή τη λειτουργία
PWN:defend.v.02	είμαι σε άμυνα, αποκρούω επίθεση που δέχομαι από κπ.
PWN:defender.n.01	αυτός που υπερασπίζεται κάποιον ή κάτι που απειλείται από έναν κίνδυνο ή δέχεται εχθρική επίθεση
PWN:defense.n.01	ομαδική προσπάθεια στρατού να προστατέψει μία χώρα και να αποκρούσει την επίθεση του αντιπάλου
PWN:defensive_structure.n.01	κατασκευή που χρησιμεύει για αμυντικούς σκοπούς
PWN:defiance.n.01	συμπεριφορά ατόμου που έχει ατίθασο,ανυπότακτο χαρακτήρα
PWN:definite_quantity.n.01	μία συγκεκριμένη καθορισμένη ποσότητα
PWN:deflect.v.02	παρουσιάζω παρέκκλιση από την κανονική,συνηθισμένη πορεία
PWN:defray.v.01	καταβάλλω χρηματικό ποσό για να πληρωθούν έξοδα που έχουν γίνει ή πρόκειται να γίνουν
PWN:degradation.n.01	η τοποθέτηση προσώπου, πράγματος κ.τ.λ. σε μια θέση κατώτερη από αυτή στην οποία βρίσκεται
PWN:degree.n.01	"θέση σε κλίμακα έντασης, σημείο νοητής κλίμακας, στο οποίο βρίσκεται ή φτάνει κάποιος ή κάτι π.χ. ""βαθμός ευφυύας, μυωπίας"""
PWN:degree.n.02	το σημείο στο οποίο φθάνει μια κατάσταση ή ιδιότητα, το επίπεδο
PWN:degree.n.06	βαθμός θερμοκρασίας σε συγκεκριμένη κλίμακα
PWN:deity.n.01	κάθε υπερφυσικό ον που λατρεύεται σαν να ελέγχει κάποιο τμήμα του κόσμου
PWN:delay.n.02	η ενέργεια του καθυστερώ, του να μην πραγματοποιεί κάποιος κάτι την προκαθορισμένη χρονική στιγμή, διάστημα
PWN:delay.v.01	κάνω κάποιον ή κάτι να καθυστερήσει, να χάσει χρόνο
PWN:delay.v.02	για ενέργεια, διαδικασία που δε γίνεται ή που δεν ολοκληρώνεται μέσα σε έναν καθορισμένο χρόνο
PWN:delegate.v.02	τοποθετώ σε μια θέση ως αποτέλεσμα εκλογής ή επιλογής μεταξύ άλλων υποψηφίων π .χ. τον έκαναν διευθυντή της εφημερίδας
PWN:delight.n.01	το αίσθημα της απόλυτης ικανοποίησης και ευχαρίστησης
PWN:deliver.v.02	δίνω κτ στα χέρια κάποιου
PWN:delivery.n.01	η ενέργεια του διανέμω, το μοίρασμα διαφόρων πραγμάτων στους δικαιούχους τους
PWN:demand.n.02	η ικανότητα και η επιθυμία για αγορά προϊόντων και υπηρεσιών
PWN:demand.v.01	απαιτώ, αξιώνω
PWN:demeanor.n.01	ο τρόπος με τον οποίο ενεργεί ένα άτομο, από την άποψη της τήρησης ή όχι των κανόνων που επιβάλλει η ευγένεια, στις κοινωνικές σχέσεις του
PWN:democracy.n.02	πολίτευμα με μορφές κατά κοινωνίες και ιστορικές περιόδους, σύμφωνα με το οποίο η πολιτική εξουσία πηγάζει από το λαό και ασκείται προς όφελός του, βσικές δε αρχές του αποτελούν η ισονομία, η ισοπολιτεία, η κατοχύρωση των θεμελιωδών ανθρωπίνων δικαιωμάτων
PWN:demonstration.n.05	οπτική παρουσίαση της λειτουργίας κάποιου πράγματος, π.χ. προϊόντος
PWN:demoralization.n.01	καταστροφή και άρνηση των ηθικών αξιών για κάποιο δόγμα ή πολιτική
PWN:demoralization.n.03	το να γίνεται το ήθος, ο χαρακτήρας κάποιου αχρείος
PWN:denial.n.01	στάση ή συμπεριφορά που χαρακτηρίζεται από άρνηση σε εξωτερικές απαιτήσεις
PWN:denote.v.02	για κάτι που εννοιολογικά ταυτίζεται με κάτι άλλο
PWN:dentist.n.01	ο γιατρός που είναι ειδικευμένος στην υγιεινή των δοντιών και του στόματος
PWN:denude.v.01	γυμνώνω κάποιον
PWN:deny.v.04	αρνούμαι να (απο )δεχθώ
PWN:deoxidize.v.01	η αφαίρεση του οξυγόνου (χημεία)
PWN:depart.v.03	φεύγω έχοντας συγκεκριμένο προορισμό
PWN:depart.v.04	βγαίνω έξω ή φεύγω μακρυά από συγκεκριμένο σημείο
PWN:department.n.01	ειδικευμένη διαίρεση μιας μεγάλης οργάνωσης
PWN:departure.n.01	το ξεκίνημα, η απομάκρυνση από ένα τόπο σε ένα άλλο
PWN:depend.v.01	βασίζομαι σε όρους και προϋποθέσεις προκειμένου να κάνω κάτι
PWN:deploy.v.01	τοποθετώ σε συνεχόμενη διάταξη,δίπλα-δίπλα,βάζω στη σειρά ή στοιχίζω σε ζυγούς
PWN:deposit.n.06	χρήματα που δίνονται ως ασφάλεια για ένα αντικείμενο για προσωρινή χρήση
PWN:deposit.n.09	το αποτέλεσμα του καταθέτω, του τοποθετώ κάτι, κάπου
PWN:deposit.v.02	παραδίδω χρήματα σε τράπεζα για φύλαξη, τοκισμό και μελλοντική επιστροφή τους
PWN:depository.n.01	ο χώρος ή το κτίσμα μέσα στο οποίο φυλάσσονται διάφορα είδη
PWN:depository_financial_institution.n.01	οικονομικός οργανισμός που δέχεται καταθέσεις και επενδύει τα χρήματα με διάφορους τρόπους
PWN:depression.n.01	(ψυχιατρ.) ψυχική νόσος που χαρακτηρίζεται από μόνιμη μελαγχολία, αποθάρρυνση, εσωστρέφεια και γενικά αρνητική αντιμετώπιση της ζωής
PWN:deprive.v.02	στερώ από κάποιον κάτι, εμποδίζω κάποιον να απολαύσει ένα αγαθό, του αφαιρώ κάτι που έχει ή του αρνούμαι κάτι που θέλει και ελπίζει να έχει
PWN:depth.n.01	(για τρισδιάστατα αντικείμενα, που έχουν κενό το εσωτερικό τους, ώστε να δέχονται πράγματα, ή για εσοχές στο χώρο) η διάσταση του μήκους (κατ' αντιδιαστολή προς το ύψος και το πλάτος τους)
PWN:depth.n.03	ο ίδιος ο πυθμένας, ο βυθός
PWN:deputation.n.01	σύνολο αντιπροσώπων ή εκπροσώπων
PWN:descend.v.01	οδηγούμαι ή μετακινούμαι προς τα κάτω, πηγαίνω από υψηλότερο σημείο σε χαμηλότερο, πέφτω σε χαμηλότερο σημείο
PWN:descent.n.03	η ενέργεια του κατεβαίνω, το κατέβασμα από κάποιο ψηλότερο σημείο σε ένα μέρος που βρίσκεται πιο χαμηλά
PWN:describe.v.01	κάνω αναπαράσταση ενός γεγονότος ή πράγματος, δίνω περιγραφή
PWN:description.n.01	η διαδικασία απόδοσης (με γραπτό ή προφορικό λόγο, κινήσεις, σχέδια) των χαρακτηριστικών προσώπου, αντικειμένου, κατάστασης, γεγονότος, ώστε να μπορεί κάποιος να σχηματίσει μια όσο το δυνατόν ακριβέστερη εικόνα γι' αυτά
PWN:description.n.02	η ενέργεια ή το αποτέλεσμα του περιγράφω
PWN:descry.v.01	αναγνωρίζω κάποιον ή κάτι με τις αισθήσεις ή με τη λογική μου, σχηματίζω την οπτική ή ακουστική του παράσταση στη σκέψη μου
PWN:desert.n.01	άνυδρη, αμμώδης περιοχή μεγάλης έκτασης, με ελάχιστο δείκτη βροχοπτώσεων, που μπορεί να συντηρεί πολύ λίγες κατάλληλα προσαρμοσμένες μορφές ζωής
PWN:design.n.04	διακοσμητικό ή καλλιτεχνικό σχέδιο
PWN:designate.v.01	αποδίδω (σε κάποιον, κάτι) πρόσθετο (συνήθως πιο εκφραστικό ή χαρακτηριστικό) όνομα, αποκαλώ (κάποιον) με καινούργια ονομασία (βάσει γνωστού χαρακτηριστικού του)
PWN:desire.n.01	το συναίσθημα που συνοδεύει μια ανικανοποίητη κατάσταση, το να θέλει κανείς κάτι.
PWN:desire.v.01	θέλω πολύ, έχω, αισθάνομαι ορισμένη επιθυμία, για να αποκτήσω ή για να πραγματοποιήσω κάτι, λαχταρώ, ποθώ
PWN:desk.n.01	έπιπλο που έχει επιφάνεια για γράψιμο και συνήθως συρτάρια και άλλα τμήματα
PWN:dessert.n.01	γλυκό ή φρούτο που σερβίρεται μετά το κύριο γεύμα
PWN:destiny.n.01	αυτό που έχει ήδη αποφασιστεί να γίνει, που έχει καθοριστεί από ανώτερη δύναμη (τη μοίρα)
PWN:destiny.n.02	η δύναμη που θεωρείται ότι προκαθορίζει όσα πρόκειται να συμβούν
PWN:destroy.v.01	προκαλώ βλάβη σε κάτι
PWN:destroy.v.02	φθείρω εντελώς από υλικής απόψεως
PWN:destroyer.n.01	πολεμικό πλοίο με ειδικό εξοπλισμό, κατάλληλο για την καταδίωξη τορπιλοβόλων ή για την απόκρουση τορπιλών
PWN:destruction.n.01	εξαφάνιση από ολοκληρωτική φθορά
PWN:destruction.n.02	συμβάν ή κατάσταση με δυσμενέστατες συνέπειες
PWN:detach.v.03	αποσπώ κτ από σημείο στο οποίο είχε κολλήσει ή από άλλο αντικείμενο με το οποίο είναι στενά συνδεδεμένο ή κολλημένο
PWN:detail.n.01	ένα μικρό, μεμονωμένο μέρος ενός μεγαλύτερου όλου, ένα μεμονωμένο τμήμα μιας ευρύτερης ενότητας
PWN:detail.n.02	μικρό τμήμα που μπορεί να εξεταστεί χωριστά από το σύνολο
PWN:detect.v.01	διαπιστώνω, συνειδητοποιώ ότι κάποιος ή κάτι υπάρχει ή έχει ορισμένη ιδιότητα
PWN:detention.n.01	κατάσταση περιορισμού (συνήθως για μικρό χρονικό διάστημα)
PWN:deterioration.n.02	διαδικασία περάσματος σε χειρότερη κατάσταση
PWN:determine.v.01	γνωρίζω, καταλαβαίνω κάτι ύστερα από έρευνα, έλεγχο κ.τ.λ.
PWN:determine.v.03	ορίζω κάτι με ακρίβεια, προσδιορίζω, αποφασίζω, κάνω μια εκτίμηση
PWN:develop.v.03	(για γνώσεις) έχω κάτι που δεν το είχα προηγουμένως
PWN:develop.v.10	μεταβάλλομαι σε κάτι καλύτερο, μεγαλώνω
PWN:development.n.01	σταδιακή αύξηση ή βελτίωση ή μεγέθυνση
PWN:development.n.02	η διαδικασία αλλαγής ή αναπτύξεως (συνήθως από κατώτερο ή απλούστερο σε ανώτερο ή συνθετότερο επίπεδο), εξέλιξη που οδηγεί σε βελτίωση
PWN:development.n.07	κατάσταση που χαρακτηρίζεται από διαδοχικές αλλαγές που συμβαίνουν σε κάτι
PWN:development.n.08	επεξεργασία σε φωτογραφικό υλικό προκειμένου να γίνει εμφάνιση εικόνας
PWN:deviation.n.01	η διαφοροποίηση από αυτό που θεωρείται κανονικό, αποδεκτό, δεδομένο
PWN:device.n.01	συσκευή που έχει επινοηθεί ώστε να επιτελεί συγκεκριμένο σκοπό
PWN:device.n.02	κάτι σε μια καλλιτεχνική δουλειά που σχεδιάζεται για να πετύχει έναν συγκεκριμένο στόχο
PWN:device.n.05	εμβληματικό σχέδιο
PWN:devolve.v.03	γίνομαι χειρότερος
PWN:dew.n.01	η πρωινή παγωμένη υγρασία
PWN:dial.n.01	η πρόσοψη ωρολογιακής συσκευής που είναι έτσι διαβαθμισμένη για να δείχνει τις ώρες
PWN:dictate.v.02	απαγγέλλω κάτι για να το γράψει ή να το επαναλάβει κάποιος
