id	Definition
PWN:speak.v.03	esprimersi attraverso il linguaggio verbale
PWN:speech.n.02	lo strumento che si utilizza per comunicare verbalmente
PWN:square.n.02	il prodotto di due termini uguali
PWN:stadium.n.01	una grande struttura per sports all'aria aperta
PWN:stalk.n.02	la parte delle piante cormofite che si erge verticalmente e collega le radici alle foglie, svolgendo funzione di sostegno e di distribuzione delle sostanze nutritive
PWN:star.n.01	corpo celeste caratterizzato da emissione di luce
PWN:state.n.03	organizzazione politica e giuridica di una società civile
PWN:state.v.01	esprimere qualcosa verbalmente
PWN:step.n.03	movimento compiuto dagli arti inferiori per camminare
PWN:street.n.01	terreno di uso pubblico, opportunamente pavimentato che consente l'accesso agli edifici di un centro abitato
PWN:strike.n.01	astensione totale o parziale dal lavoro per protesta
PWN:study.n.02	applicazione della mente volta all'apprendimento o alla conoscenza di qualcosa
PWN:style.n.03	un tipo particolare (con riferimento alla apparenza)
PWN:subject.n.02	qualcosa (una persona, oggetto o scena) selezionata da un artista o fotografo per una rappresentazione grafica
PWN:subtract.v.01	detrarre un importo da una somma
PWN:succeed.v.01	avere buoni risultati
PWN:sum.n.01	una quantità monetaria
PWN:summer.n.01	la stagione più calda dell'anno, tra la primavera e l'autunno
PWN:summit.n.03	incontro, riunione fra capi di stato o dirigenti ad alto livello o tra le massime autorità di organizzazioni, enti, partiti, gruppi e simili
PWN:sun.n.01	la stella attorno alla quale gravitano i corpi celesti del sistema solare
PWN:sunday.n.01	settimo giorno della settimana civile e primo di quella liturgica
PWN:sunlight.n.01	luce e calore emanati da tale astro
PWN:supper.n.01	il pasto della sera
PWN:sweetening.n.01	sostanza usate per dolcificare i cibi
PWN:sword.n.01	arma bianca da taglio
PWN:symbol.n.01	Segno arbitrario che ha aquisito un significato convenzionale
PWN:table.n.02	parte del mobilio;
PWN:table.n.03	un tavolo apparechiato per mangiare
PWN:talk.v.01	comunicare verbalmente con qualcuno di qualcosa
PWN:talk.v.02	usare la propria voce nel proferire parola
PWN:taste.v.01	essere dotato di un particolare sapore
PWN:taste.v.02	percepire un sapore attraverso il senso del gusto
PWN:teacher.n.01	una persona la cui occupazione è l'insegnamento
PWN:team.n.01	gruppo di persone unite da un comune intento
PWN:team.n.02	insieme di animali necessari per trainare un veicolo
PWN:telegram.n.01	messaggio trasmesso tramite il telegrafo
PWN:television.n.01	programma trasmesso alla televisione
PWN:television_receiver.n.01	apparecchio per ricevere programmi televisivi
PWN:tell.v.02	dare comunicazione a scopo informativo
PWN:tell.v.03	esporre in forma narrativa, con una consequenzialità logica
PWN:temper.n.02	una caratteristica psicologica o uno stato mentale abituale di una persona
PWN:temple.n.01	edificio dedicato al culto di una divinità
PWN:tense.n.01	categoria grammaticale che nei verbi distingue anteriorità, contemporaneità, posteriorità dell'azione da essi indicata
PWN:testis.n.01	ciascuna delle due ghiandole genitali maschili destinate alla produzione degli spermatozoi
PWN:theater.n.01	il teatro era pieno
PWN:thief.n.01	criminale che si appropria di oggetti appartenenti a qualcun altro con lo scopo di tenerseli
PWN:thigh.n.01	parte della gamba tra l'anca e il ginocchio
PWN:thing.n.01	una particolare situazione
PWN:thing.n.02	quello che si fa
PWN:thing.n.04	qualcosa che sia stato realizzato dall'uomo
PWN:thing.n.05	quello che accade
PWN:thing.n.07	quello che si dice
PWN:thing.n.08	una entità non identificabile
PWN:thing.n.09	una delle qualità caratteristiche di qualcuno o qualcosa
PWN:thursday.n.01	giorno della settimana
PWN:ticket.n.01	documento commerciale che permette di utilizzare trasporti pubblici o di entrare in vari locali (es. cinema, teatro, etc.)
PWN:tiger.n.02	animale felino
PWN:time.n.01	tempo, occasione, in cui si verifica o si è verificato un evento
PWN:time.n.02	intervallo di tempo sotto il proprio controllo destinato allo solgersi di un'attività
PWN:time.n.03	intervallo di tempo indefinito
PWN:time.n.04	occasione opportuna per fare qualcosa
PWN:time.n.05	una fase nel flusso dell'esperienza nel quale gli eventi passano dal futuro al passato attraverso il presente
PWN:time_of_life.n.01	ciascuna delle fasi in cui si può suddividere la vita dell'uomo
PWN:tool.n.01	strumento usato per svolgere una determinata attivà
PWN:top.n.01	la parte superiore
PWN:top.n.08	giocattolo costituito da un cono rovesciato, di legno o altro materiale, munito di una punta metallica sulla quale viene fatto roteare velocemente
PWN:torso.n.01	parte del corpo umano compresa tra il collo e il bacino
PWN:tournament.n.01	competizione organizzata in una serie di gare in cui i concorrenti si incontrano a turno, fino alla designazione del vincitore finale
PWN:translate.v.01	volgere in una determinata lingua una parola o frase espressi originariamente in un'altra lingua
PWN:travel.v.01	cambiare la propria posizione nello spazio
PWN:travel.v.05	spostarsi con mezzi di trasporto
PWN:tree.n.01	ogni pianta perenne con fusto legnoso (tronco) ramificato
PWN:trip.n.01	percorso secondo un itinerario stabilito con uno scopo preciso
PWN:turn.n.03	avvicendamento di persone in una data attività secondo un ordine stabilito
PWN:uncle.n.01	il fratello della madre o del padre
PWN:understand.v.02	acquisire coscienza
PWN:undertaking.n.01	svolgimento di una determinata attività
PWN:utensil.n.01	attrezzo usato comunemente nei lavori di casa, soprattutto in cucina
PWN:vault.n.03	struttura a superficie curva che fa da soffitto a un edificio o ambiente
PWN:vertebrate.n.01	animale caratterizzato da uno scheletro osseo o cartilaginoso, una colonna vertebrale segmentata, e un cervello di grandi dimensioni contenuto nel cranio
PWN:visualize.v.01	costruire l'immagine mentale di una situazione
PWN:vogue.n.01	il gusto diffuso in un certo periodo
PWN:voice.n.01	timbro di voce
PWN:voice.n.02	suono prodotto dalla laringe nel momento in cui l'aria incontra le corde vocali mettendole in vibrazione
PWN:volition.n.01	manifestazione consapevole dei propri desideri
PWN:vote.n.01	atto con cui si manifesta la propria volontà nella scelta di un candidato o di un programma
PWN:waist.n.01	la parte incavata del corpo umano tra i fianchi e il busto
PWN:walk.v.01	spostarsi usando le proprie gambe
PWN:want.v.02	trovarsi nella necessità di qualcosa in particolare
PWN:war.n.01	conflitto fra stati (o all'interno di uno stato), nazioni, popoli, condotto con le armi
PWN:ware.n.01	articoli fatti con un certo materiale, o adibiti a un certo uso
PWN:watch.v.01	scrutare attivamente, con interesse e attenzione
PWN:watch.v.02	controllare qualcuno o qualcosa con tutta la propria attenzione per salvaguardia o per evitarne la fuga
PWN:water.n.06	liquido trasparente incolore, inodore e insapore, la cui molecola è formata da due atomi di idrogeno e uno di ossigeno
PWN:water_system.n.02	ente fornitore di acqua
PWN:way.n.05	modo di vivere
PWN:way.n.06	struttura fisica che consente il passaggio da un luogo a un altro
PWN:weather.n.01	condizioni meteorologiche
PWN:week.n.01	periodo di sette giorni consecutivi
PWN:week.n.03	periodo di sette giorni, dal lunedì alla domenica, in cui è suddiviso l’anno civile
PWN:whole.n.01	gruppo di più cose o elementi unite a formare un tutto
PWN:wife.n.01	una donna unita in matrimonio con un uomo
PWN:win.v.01	portare a termine con successo uno scontro, una competizione, una prova
PWN:wish.v.01	essere intenzionato a fare una certa cosa
PWN:wolf.n.01	mammifero carnivoro predatore del Nord America e dell'Eurasia che caccia in branco
PWN:woman.n.01	persona adulta di sesso femminile
PWN:wood.n.01	sostanta dura e fibrosa sotstante la corteccia degli alberi
PWN:work.n.01	impiego di energia per il raggiungimento di uno scopo
PWN:work.n.02	frutto dell'attività di persone o cose
PWN:worker.n.01	persona che ha un lavoro
PWN:workplace.n.01	luogo ove si esercita la propria attività lavorativa
PWN:world.n.08	insieme degli abitanti della terra, il complesso di tutti gli esseri umani
PWN:write.v.01	creare un'opera letteraria
PWN:write.v.02	esprimere qualcosa tramite la scrittura
PWN:write.v.07	realizzare graficamente
PWN:writer.n.01	qualcuno che scrive (libri, articoli o simili) professionalmente (a pagamento)
PWN:year.n.01	periodo di 365 (o 366) giorni calcolato a partire da un giorno qualsiasi
PWN:year.n.02	periodo di tempo basato su una particolare attività che occupa regolarmente una parte dell'anno
PWN:year.n.03	il periodo di tempo impiegato da un pianeta (come, per esempio, la Terra o Marte) per compiere un giro completo intorno al sole
PWN:yield.v.01	essere causa di qualcosa
